{
  "schema_version": "0.1",
  "registry_id": "TEMPLATE-REGISTRY-DEMO",
  "updated_at": "2026-08-16T11:47:00+08:00",
  "assets": [
    {
      "asset_id": "TPL-USER-001",
      "name": "我的民事起诉状模板",
      "scope": "USER",
      "scope_ref": null,
      "document_types": [
        "民事起诉状"
      ],
      "file_path": "custom-templates/我的民事起诉状模板.docx",
      "format": "DOCX",
      "source_type": "USER_PROVIDED",
      "application_mode": "GUIDED_STRUCTURE",
      "status": "ACTIVE",
      "sha256": null,
      "version_label": "user-v1",
      "notes": [
        "示例，不包含真实模板文件"
      ]
    }
  ],
  "notes": [
    "示例文件，不代表系统替真实用户登记模板。"
  ]
}
